NC_018855	Enterobacteria phage HX01, complete genome.	Escherichia coli
NC_019398	Cronobacter phage vB_CsaM_GAP161, complete genome.	Cronobacter sakazakii
NC_019400	Cronobacter phage vB_CsaM_GAP31, complete genome.	Cronobacter sakazakii
NC_019416	Stenotrophomonas phage IME15, complete genome.	Stenotrophomonas maltophilia
NC_019423	Enterobacter phage IME11, complete genome.	Escherichia coli
NC_019538	Aeromonas phage CC2, complete genome.	Aeromonas hydrophila
NC_019539	Salmonella phage vB_SenS-Ent1, complete genome.	Salmonella enterica
NC_019541	Acinetobacter phage Bphi-B1251, complete genome.	Acinetobacter baumannii
NC_019543	Aeromonas phage Aes508, complete genome.	Aeromonas salmonicida
NC_019545	Salmonella phage SPN3UB, complete genome.	Salmonella typhimurium
NC_019548	Ralstonia phage RSS0, complete genome.	Ralstonia solanacearum
NC_005178	Pseudomonas phage D3112, complete genome.	Pseudomonas aeruginosa
NC_004333	Burkholderia phage Bcep781, complete genome.	Burkholderia cepacia
NC_004775	Enterobacteria phage epsilon15, complete genome.	Salmonella enterica
NC_005263	Burkholderia phage Bcep1, complete genome.	Burkholderia cenocepacia
NC_005882	Burkholderia phage BcepMu, complete genome.	Burkholderia cenocepacia
NC_005886	Burkholderia phage BcepB1A, complete genome.	Burkholderia cenocepacia
NC_005964	Mycoplasma phage phiMFV1, complete genome.	Mycoplasma fermentans
NC_007497	Burkholderia phage Bcep176, complete genome.	Burkholderia cepacia
NC_008717	Pseudomonas phage DMS3, complete genome.	Pseudomonas aeruginosa
NC_009818	Pseudomonas phage MP22, complete genome.	Pseudomonas aeruginosa
NC_011216	Burkholderia phage KS10, complete genome.	Burkholderia cenocepacia
NC_019517	Enterobacteria phage vB_EcoM-FV3, complete genome.	Escherichia coli
NC_019726	Staphylococcus phage JD007, complete genome.	Staphylococcus aureus
NC_019781	Klebsiella phage KP36, complete genome.	Klebsiella pneumoniae
NC_019813	Pseudomonas phage vB_PaeP_p2-10_Or1, complete genome.	Pseudomonas aeruginosa
NC_009993	Mycobacterium phage Giles, complete genome.	Mycobacterium smegmatis
NC_019909	Yersinia phage phiR1-RT complete genome.	Yersinia enterocolitica
NC_019911	Yersinia phage phi80-18 complete genome.	Yersinia enterocolitica
NC_019916	Lactobacillus phage ATCC 8014-B1, complete genome.	Lactobacillus plantarum
NC_019917	Burkholderia phage BcepMigl, complete genome.	Burkholderia cenocepacia
NC_019919	Yersinia phage phiR201 complete genome.	Yersinia enterocolitica
NC_019927	Cronobacter phage ENT47670, complete genome.	Cronobacter sakazakii
NC_019928	Helicobacter phage KHP30 DNA, complete genome.	Helicobacter pylori
NC_019931	Helicobacter phage KHP40 DNA, complete genome.	Helicobacter pylori
NC_019932	Erwinia phage ENT90, complete genome.	Erwinia amylovora
NC_019934	Cronobacter phage ENT39118, complete genome.	Cronobacter sakazakii
NC_019935	Pseudomonas phage KPP12 DNA, complete genome.	Pseudomonas aeruginosa
NC_017971	Pseudomonas phage tf complete genome.	Pseudomonas putida
NC_020197	Streptococcus phage TP-J34 complete genome.	Streptococcus thermophilus
NC_020201	Pectobacterium phage phiTE, complete genome.	Pectobacterium atrosepticum
NC_020204	Klebsiella phage JD001, complete genome.	Klebsiella pneumoniae
NC_020080	Klebsiella phage KP27, complete genome.	Klebsiella pneumoniae
NC_018086	Enterococcus phage BC-611, complete genome.	Enterococcus faecalis
NC_016563	Bacillus phage W.Ph., complete genome.	Bacillus cereus
NC_019449	Lactobacillus phage c5, complete genome.	Lactobacillus delbrueckii
NC_019450	Pseudomonas phage JG004, complete genome.	Pseudomonas aeruginosa
NC_018856	Bacillus phage Bastille, complete genome.	Bacillus cereus
NC_020414	Enterobacteria phage UAB_Phi78, complete genome.	Salmonella enterica
NC_020488	Vibrio phage VvAW1, complete genome.	Vibrio vulnificus
NC_019912	Bacillus phage BMBtp2, complete genome.	Bacillus thuringiensis
NC_020489	Rhodobacter phage RcapNL, complete genome.	Rhodobacter capsulatus
NC_016653	Rhodococcus phage RER2, complete genome.	Rhodococcus erythropolis
NC_009811	Listeria phage A511, complete genome.	Listeria monocytogenes
NC_011041	Escherichia coli bacteriophage rv5, complete sequence.	Escherichia coli
NC_004678	Staphylococcus phage 44AHJD, complete genome.	Staphylococcus aureus
NC_015251	Aeromonas phage 65, complete genome.	Aeromonas salmonicida
NC_020416	Salmonella phage S16, complete genome.	Salmonella enterica
NC_020873	Bacillus cereus bacteriophage vB_BceM_Bc431v3, complete genome.	Bacillus cereus
NC_020876	Mycobacterium phage First, complete genome.	Mycobacterium smegmatis
NC_021062	Pseudomonas phage Phi-S1, complete genome.	Pseudomonas fluorescens
NC_018832	Providencia phage Redjac, complete genome.	Providencia stuartii
NC_018850	Pseudomonas phage UFV-P2, complete genome.	Pseudomonas fluorescens
NC_019918	Pseudomonas phage vB_PaeM_C2-10_Ab1 complete genome.	Pseudomonas aeruginosa
NC_019913	Pseudomonas phage PaP1, complete genome.	Pseudomonas aeruginosa
NC_020883	Bacillus phage PM1 DNA, complete genome.	Bacillus subtilis
NC_016655	Rhodococcus phage REQ1, complete genome.	Rhodococcus equi
NC_021556	Mycobacterium phage Leo, complete genome.	Mycobacterium tuberculosis;
NC_021569	Stenotrophomonas phage phiSMA7 proviral complete genome.	Stenotrophomonas maltophilia
NC_019418	Streptococcus phage phiNJ2, complete genome.	Streptococcus suis
NC_021347	Rhodococcus phage E3, complete genome.	Rhodococcus equi
NC_021326	Staphylococcus phage StauST398-1, complete genome.	Staphylococcus aureus
NC_021332	Staphylococcus phage StauST398-3, complete genome.	Staphylococcus aureus
NC_021531	Cronobacter phage CR5, complete genome.	Cronobacter sakazakii
NC_021316	Acinetobacter phage Abp1, complete genome.	Acinetobacter baumannii
NC_021533	Mycobacterium phage BTCU-1, complete genome.	Mycobacterium smegmatis
NC_021337	Acinetobacter phage AB3, complete genome.	carbapenem-resistant Acinetobacter
NC_021323	Staphylococcus phage StauST398-2, complete genome.	Staphylococcus aureus
NC_021343	Burkholderia phage ST79, complete genome.	Burkholderia pseudomallei
NC_021540	Vibrio phage JA-1, complete genome.	Vibrio cholerae
NC_021532	Alteromonas phage vB_AmaP_AD45-P1, complete genome.	Alteromonas macleodii
NC_021317	Salmonella phage L13, complete genome.	Salmonella gallinarum
NC_021334	Mycobacterium phage WIVsmall, complete genome.	mycobacterium smegmatis
NC_021338	Mycobacterium phage Chy4, complete genome.	Mycobacterium tuberculosis;
NC_021318	Mycobacterium phage Chy5, complete genome.	Mycobacterium tuberculosis;
NC_021775	Salmonella phage FSL SP-031, complete genome.	Salmonella enterica
NC_021779	Salmonella phage FSL SP-030, complete genome.	Salmonella enterica
NC_021780	Salmonella phage FSL SP-088, complete genome.	Salmonella enterica
NC_021774	Salmonella phage FSL SP-004, complete genome.	Salmonella enterica
NC_021859	Mycobacterium phage DNAIII, complete genome.	Mycobacterium tuberculosis;
NC_021861	Lactococcus phage BM13, complete genome.	Lactococcus lactis
NC_021336	Bacillus phage MG-B1, complete genome.	Bacillus weihenstephanensis
NC_021562	Vibrio phage VFJ, complete genome.	Vibrio cholerae
NC_019452	Escherichia phage PhaxI, complete genome.	Escherichia coli
NC_021856	Bacillus phage phiNIT1 DNA, complete genome.	Bacillus subtilis
NC_021862	Ralstonia phage RSS30 DNA, complete genome.	Ralstonia solanacearum
NC_021866	Ralstonia phage RSS20 DNA.	Ralstonia solanacearum
NC_001909	Lactococcus phage bIL170, complete genome.	Lactococcus lactis
NC_008363	Lactococcus phage P008, complete genome.	Lactococcus lactis
NC_001422	Enterobacteria phage phiX174 sensu lato, complete genome.	Escherichia coli
NC_000902	Enterobacteria phage VT2-Sakai, complete genome.	Escherichia coli
NC_004348	Enterobacteria phage ST64T, complete genome.	Salmonella enterica
NC_005856	Enterobacteria phage P1, complete genome.	Escherichia coli
NC_008152	Enterobacteria phage K1-5, complete genome.	Escherichia coli
NC_021325	Clostridium phage vB_CpeS-CP51, complete genome.	Clostridium perfringens
NC_007022	Aeromonas phage 31, complete genome.	Aeromonas salmonicida
NC_005135	Aeromonas phage 44RR2.8t, complete genome.	Aeromonas salmonicida
NC_020477	Bacillus phage Eoghan, complete genome.	Bacillus pumilus
NC_020478	Bacillus phage Andromeda, complete genome.	Bacillus pumilus
NC_020480	Bacillus phage Finn, complete genome.	Bacillus pumilus
NC_022323	Escherichia phage 2 JES-2013, complete genome.	Escherichia coli
NC_022334	Propionibacterium phage PHL112N00, complete genome.	Propionibacterium acnes
NC_022335	Propionibacterium phage PHL067M10, complete genome.	Propionibacterium acnes
NC_022336	Propionibacterium phage PHL010M04, complete genome.	Propionibacterium acnes
NC_022337	Propionibacterium phage PHL071N05, complete genome.	Propionibacterium acnes
NC_022338	Propionibacterium phage PHL060L00, complete genome.	Propionibacterium acnes
NC_022339	Propionibacterium phage PHL037M02, complete genome.	Propionibacterium acnes
NC_022340	Propionibacterium phage PHL114L00, complete genome.	Propionibacterium acnes
NC_022341	Propionibacterium phage PHL113M01, complete genome.	Propionibacterium acnes
NC_022342	Propionibacterium phage PHL111M01, complete genome.	Propionibacterium acnes
NC_021778	Mannheimia phage vB_MhM_1152AP, complete genome.	Mannheimia haemolytica
NC_021863	Staphylococcus phage SA13, complete genome.	Staphylococcus aureus
NC_022094	Bacillus phage Wip1, complete genome.	Bacillus anthracis
NC_019929	Erwinia phage phiEaH2, complete genome.	Erwinia amylovora
